"No.","Time","Source","Destination","Protocol","Length","Info"
"1","0.000000","46.53.176.253","192.168.0.105","UDP","62","52960  >  31536 Len=20"
"2","0.000084","192.168.0.105","46.53.176.253","UDP","62","31536  >  52960 Len=20"
"3","0.028518","46.53.176.253","192.168.0.105","UDP","130","52960  >  31536 Len=88"
"4","0.028677","192.168.0.105","46.53.176.253","UDP","62","31536  >  52960 Len=20"
"5","0.028849","192.168.0.105","46.53.176.253","UDP","985","31536  >  52960 Len=943"
"6","0.031595","192.168.0.105","173.194.73.188","TCP","55","61271  >  5228 [ACK] Seq=1 Ack=1 Win=256 Len=1"
"7","0.040549","173.194.73.188","192.168.0.105","TCP","66","5228  >  61271 [ACK] Seq=1 Ack=2 Win=180 Len=0 SLE=1 SRE=2"
"8","0.060524","46.53.176.253","192.168.0.105","UDP","62","52960  >  31536 Len=20"
"9","0.060887","46.53.176.253","192.168.0.105","UDP","904","52960  >  31536 Len=862"
"10","0.060945","192.168.0.105","46.53.176.253","UDP","62","31536  >  52960 Len=20"
"11","0.061372","192.168.0.105","46.53.176.253","UDP","62","31536  >  52960 Len=20"
"12","0.066531","46.53.176.253","192.168.0.105","UDP","62","52960  >  31536 Len=20"
"13","0.087485","46.53.176.253","192.168.0.105","UDP","62","52960  >  31536 Len=20"
"14","0.087561","192.168.0.105","46.53.176.253","UDP","62","31536  >  52960 Len=20"
"15","0.087578","192.168.0.105","46.53.176.253","UDP","62","31536  >  52960 Len=20"
"16","0.087945","46.53.176.253","192.168.0.105","UDP","62","52960  >  31536 Len=20"
"17","0.087946","46.53.176.253","192.168.0.105","UDP","62","52960  >  31536 Len=20"
"18","0.520772","192.168.0.105","86.168.130.67","UDP","62","31536  >  53681 Len=20"
"19","0.520895","192.168.0.105","31.130.96.140","TCP","66","53477  >  57286 [SYN] Seq=0 Win=64240 Len=0 MSS=1460 WS=256 SACK_PERM=1"
"20","0.615444","31.130.96.140","192.168.0.105","TCP","60","57286  >  53477 [RST, ACK] Seq=1 Ack=1 Win=0 Len=0"
"21","0.801203","192.168.0.105","5.2.208.17","UDP","62","31536  >  21470 Len=20"
"22","0.856078","192.168.0.105","185.25.180.15","TLSv1.2","117","Application Data"
"23","0.869571","192.168.0.105","192.168.0.1","DNS","89","Standard query 0x0b8c A v10.events.data.microsoft.com"
"24","0.887868","192.168.0.1","192.168.0.105","DNS","200","Standard query response 0x0b8c A v10.events.data.microsoft.com CNAME v10.events.data.microsoft.com.aria.akadns.net CNAME onecollector.cloudapp.aria.akadns.net A 52.114.128.8"
"25","0.888200","192.168.0.105","52.114.128.8","TCP","66","53478  >  443 [SYN] Seq=0 Win=64240 Len=0 MSS=1460 WS=256 SACK_PERM=1"
"26","0.900581","5.2.208.17","192.168.0.105","ICMP","70","Destination unreachable (Port unreachable)"
"27","0.916577","185.25.180.15","192.168.0.105","TCP","60","27020  >  57804 [ACK] Seq=1 Ack=64 Win=32742 Len=0"
"28","1.057523","52.114.128.8","192.168.0.105","TCP","66","443  >  53478 [SYN, ACK] Seq=0 Ack=1 Win=8192 Len=0 MSS=1412 WS=256 SACK_PERM=1"
"29","1.057605","192.168.0.105","52.114.128.8","TCP","54","53478  >  443 [ACK] Seq=1 Ack=1 Win=66304 Len=0"
"30","1.057824","192.168.0.105","52.114.128.8","TLSv1.2","266","Client Hello"
"31","1.115865","192.168.0.105","31.130.96.140","TCP","66","[TCP Retransmission] 53477  >  57286 [SYN] Seq=0 Win=64240 Len=0 MSS=1460 WS=256 SACK_PERM=1"
"32","1.169009","87.240.129.73","192.168.0.105","TLSv1.2","339","Application Data"
"33","1.199526","31.130.96.140","192.168.0.105","TCP","60","57286  >  53477 [RST, ACK] Seq=1 Ack=1 Win=0 Len=0"
"34","1.208950","192.168.0.105","87.240.129.73","TCP","54","63677  >  443 [ACK] Seq=1 Ack=286 Win=257 Len=0"
"35","1.229650","52.114.128.8","192.168.0.105","TCP","1466","443  >  53478 [ACK] Seq=1 Ack=213 Win=262400 Len=1412 [TCP segment of a reassembled PDU]"
"36","1.230336","52.114.128.8","192.168.0.105","TCP","1466","443  >  53478 [ACK] Seq=1413 Ack=213 Win=262400 Len=1412 [TCP segment of a reassembled PDU]"
"37","1.230338","52.114.128.8","192.168.0.105","TLSv1.2","952","Server Hello, Certificate, Server Key Exchange, Server Hello Done"
"38","1.230405","192.168.0.105","52.114.128.8","TCP","54","53478  >  443 [ACK] Seq=213 Ack=3723 Win=66304 Len=0"
"39","1.231253","192.168.0.105","52.114.128.8","TLSv1.2","147","Client Key Exchange, Change Cipher Spec, Encrypted Handshake Message"
"40","1.400720","52.114.128.8","192.168.0.105","TLSv1.2","105","Change Cipher Spec, Encrypted Handshake Message"
"41","1.403234","192.168.0.105","52.114.128.8","TLSv1.2","1023","Application Data"
"42","1.403287","192.168.0.105","52.114.128.8","TLSv1.2","1065","Application Data"
"43","1.518585","192.168.0.105","122.174.22.247","TCP","66","53468  >  37368 [SYN] Seq=0 Win=64240 Len=0 MSS=1460 WS=256 SACK_PERM=1"
"44","1.573296","52.114.128.8","192.168.0.105","TCP","60","443  >  53478 [ACK] Seq=3774 Ack=2286 Win=262400 Len=0"
"45","1.575043","52.114.128.8","192.168.0.105","TLSv1.2","412","Application Data"
"46","1.578651","192.168.0.105","52.114.128.8","TLSv1.2","1535","Application Data"
"47","1.578704","192.168.0.105","52.114.128.8","TLSv1.2","5604","Application Data"
"48","1.699626","192.168.0.105","31.130.96.140","TCP","66","[TCP Retransmission] 53477  >  57286 [SYN] Seq=0 Win=64240 Len=0 MSS=1460 WS=256 SACK_PERM=1"
"49","1.748449","52.114.128.8","192.168.0.105","TCP","60","443  >  53478 [ACK] Seq=4132 Ack=3767 Win=262400 Len=0"
"50","1.748450","52.114.128.8","192.168.0.105","TCP","60","443  >  53478 [ACK] Seq=4132 Ack=8003 Win=262400 Len=0"
"51","1.748450","52.114.128.8","192.168.0.105","TCP","60","443  >  53478 [ACK] Seq=4132 Ack=9317 Win=261120 Len=0"
"52","1.756636","52.114.128.8","192.168.0.105","TLSv1.2","413","Application Data"
"53","1.765146","192.168.0.105","52.114.128.8","TCP","54","53478  >  443 [FIN, ACK] Seq=9317 Ack=4491 Win=65536 Len=0"
"54","1.790496","31.130.96.140","192.168.0.105","TCP","60","57286  >  53477 [RST, ACK] Seq=1 Ack=1 Win=0 Len=0"
"55","1.815791","192.168.0.105","122.174.22.247","UDP","62","31536  >  37368 Len=20"
"56","1.934502","52.114.128.8","192.168.0.105","TCP","60","443  >  53478 [FIN, ACK] Seq=4491 Ack=9318 Win=261120 Len=0"
"57","1.934534","192.168.0.105","52.114.128.8","TCP","54","53478  >  443 [ACK] Seq=9318 Ack=4492 Win=65536 Len=0"
"58","2.107435","86.168.130.67","192.168.0.105","ICMP","90","Destination unreachable (Host unreachable)"
"59","2.527659","192.168.0.105","108.172.99.190","TCP","66","53480  >  16881 [SYN] Seq=0 Win=64240 Len=0 MSS=1460 WS=256 SACK_PERM=1"
"60","2.527709","192.168.0.105","84.123.0.87","UDP","62","31536  >  51464 Len=20"
"61","2.527764","192.168.0.105","84.123.0.87","TCP","66","53481  >  51464 [SYN] Seq=0 Win=64240 Len=0 MSS=1460 WS=256 SACK_PERM=1"
"62","2.533271","192.168.0.105","191.187.163.144","TCP","66","53475  >  8073 [SYN] Seq=0 Win=64240 Len=0 MSS=1460 WS=256 SACK_PERM=1"
"63","2.533307","192.168.0.105","202.28.247.114","TCP","66","53476  >  7640 [SYN] Seq=0 Win=64240 Len=0 MSS=1460 WS=256 SACK_PERM=1"
"64","2.536621","192.168.0.105","84.50.131.19","TCP","66","53474  >  23294 [SYN] Seq=0 Win=64240 Len=0 MSS=1460 WS=256 SACK_PERM=1"
"65","2.724450","108.172.99.190","192.168.0.105","TCP","66","16881  >  53480 [SYN, ACK] Seq=0 Ack=1 Win=29200 Len=0 MSS=1412 SACK_PERM=1 WS=128"
"66","2.724583","192.168.0.105","108.172.99.190","TCP","54","53480  >  16881 [ACK] Seq=1 Ack=1 Win=66304 Len=0"
"67","2.724937","192.168.0.105","108.172.99.190","BitTorrent","122","Handshake  "
"68","2.826130","192.168.0.105","84.50.131.19","UDP","62","31536  >  23294 Len=20"
"69","2.826172","192.168.0.105","191.187.163.144","UDP","62","31536  >  8073 Len=20"
"70","2.921143","108.172.99.190","192.168.0.105","TCP","60","16881  >  53480 [ACK] Seq=1 Ack=69 Win=29312 Len=0"
"71","2.941593","108.172.99.190","192.168.0.105","TCP","60","16881  >  53480 [FIN, ACK] Seq=1 Ack=69 Win=29312 Len=0"
"72","2.941690","192.168.0.105","108.172.99.190","TCP","54","53480  >  16881 [ACK] Seq=69 Ack=2 Win=66304 Len=0"
"73","2.941901","192.168.0.105","108.172.99.190","TCP","54","53480  >  16881 [FIN, ACK] Seq=69 Ack=2 Win=66304 Len=0"
"74","3.137467","108.172.99.190","192.168.0.105","TCP","60","16881  >  53480 [ACK] Seq=2 Ack=70 Win=29312 Len=0"
"75","3.285243","192.168.0.105","37.244.54.10","TLSv1.2","123","Application Data"
"76","3.338841","37.244.54.10","192.168.0.105","TCP","60","1119  >  57590 [ACK] Seq=1 Ack=70 Win=420 Len=0"
"77","3.502539","192.168.0.105","37.193.165.43","UDP","145","31536  >  35221 Len=103"
"78","3.556067","37.193.165.43","192.168.0.105","UDP","331","35221  >  31536 Len=289"
"79","3.836490","192.168.0.105","86.168.130.67","UDP","62","31536  >  53681 Len=20"
"80","4.157573","192.168.0.105","87.240.129.73","TLSv1.2","883","Application Data"
"81","4.157627","192.168.0.105","87.240.129.73","TLSv1.2","357","Application Data"
"82","4.161535","87.240.129.73","192.168.0.105","TCP","60","443  >  63677 [ACK] Seq=286 Ack=1133 Win=356 Len=0"
"83","4.161536","87.240.129.73","192.168.0.105","TLSv1.2","96","Application Data"
"84","4.201775","192.168.0.105","87.240.129.73","TCP","54","63677  >  443 [ACK] Seq=1133 Ack=328 Win=257 Len=0"
"85","4.526142","192.168.0.105","109.252.15.139","UDP","62","31536  >  28993 Len=20"
"86","4.526255","192.168.0.105","109.252.15.139","TCP","66","53482  >  28993 [SYN] Seq=0 Win=64240 Len=0 MSS=1460 WS=256 SACK_PERM=1"
"87","4.749215","104.16.60.37","192.168.0.105","TLSv1.2","205","Application Data"
"88","4.789454","192.168.0.105","104.16.60.37","TCP","54","50262  >  443 [ACK] Seq=1 Ack=152 Win=255 Len=0"
"89","4.858935","192.168.0.105","188.25.226.198","UDP","62","31536  >  1241 Len=20"
"90","5.207461","86.168.130.67","192.168.0.105","ICMP","90","Destination unreachable (Host unreachable)"
"91","5.518360","192.168.0.105","71.191.49.148","TCP","66","53485  >  44829 [SYN] Seq=0 Win=64240 Len=0 MSS=1460 WS=256 SACK_PERM=1"
"92","5.518453","192.168.0.105","71.191.49.148","UDP","62","31536  >  44829 Len=20"
"93","5.518508","192.168.0.105","2.60.74.220","UDP","62","31536  >  26337 Len=20"
"94","5.518619","192.168.0.105","2.60.74.220","TCP","66","53486  >  26337 [SYN] Seq=0 Win=64240 Len=0 MSS=1460 WS=256 SACK_PERM=1"
"95","5.518661","192.168.0.105","188.168.215.53","UDP","62","31536  >  30561 Len=20"
"96","5.518778","192.168.0.105","188.168.215.53","TCP","66","53487  >  30561 [SYN] Seq=0 Win=64240 Len=0 MSS=1460 WS=256 SACK_PERM=1"
"97","5.527907","192.168.0.105","188.25.226.198","TCP","66","53472  >  1241 [SYN] Seq=0 Win=64240 Len=0 MSS=1460 WS=256 SACK_PERM=1"
"98","5.528838","192.168.0.105","84.123.0.87","TCP","66","[TCP Retransmission] 53481  >  51464 [SYN] Seq=0 Win=64240 Len=0 MSS=1460 WS=256 SACK_PERM=1"
"99","5.568672","2.60.74.220","192.168.0.105","ICMP","90","Destination unreachable (Port unreachable)"
"100","5.575978","2.60.74.220","192.168.0.105","TCP","60","26337  >  53486 [RST, ACK] Seq=1 Ack=1 Win=0 Len=0"
"101","5.876754","192.168.0.105","84.123.0.87","UDP","62","31536  >  51464 Len=20"
"102","6.005677","104.16.60.37","192.168.0.105","TLSv1.2","159","Application Data"
"103","6.018724","64.233.162.189","192.168.0.105","UDP","83","443  >  51086 Len=41"
"104","6.019984","64.233.162.189","192.168.0.105","UDP","61","443  >  51086 Len=19"
"105","6.021392","192.168.0.105","64.233.162.189","UDP","81","51086  >  443 Len=39"
"106","6.033215","192.168.0.105","64.233.162.189","UDP","306","51086  >  443 Len=264"
"107","6.045131","64.233.162.189","192.168.0.105","UDP","67","443  >  51086 Len=25"
"108","6.046549","64.233.162.189","192.168.0.105","UDP","230","443  >  51086 Len=188"
"109","6.046551","64.233.162.189","192.168.0.105","UDP","81","443  >  51086 Len=39"
"110","6.046611","192.168.0.105","104.16.60.37","TCP","54","50262  >  443 [ACK] Seq=1 Ack=257 Win=255 Len=0"
"111","6.050418","192.168.0.105","64.233.162.189","UDP","84","51086  >  443 Len=42"
"112","6.075876","192.168.0.105","2.60.74.220","TCP","66","[TCP Retransmission] 53486  >  26337 [SYN] Seq=0 Win=64240 Len=0 MSS=1460 WS=256 SACK_PERM=1"
"113","6.140165","2.60.74.220","192.168.0.105","TCP","60","26337  >  53486 [RST, ACK] Seq=1 Ack=1 Win=0 Len=0"
"114","6.540052","192.168.0.105","123.201.77.69","UDP","62","31536  >  25610 Len=20"
"115","6.640893","192.168.0.105","2.60.74.220","TCP","66","[TCP Retransmission] 53486  >  26337 [SYN] Seq=0 Win=64240 Len=0 MSS=1460 WS=256 SACK_PERM=1"
"116","6.697504","2.60.74.220","192.168.0.105","TCP","60","26337  >  53486 [RST, ACK] Seq=1 Ack=1 Win=0 Len=0"
"117","6.851553","123.201.77.69","192.168.0.105","ICMP","90","Destination unreachable (Host unreachable)"
"118","6.901609","192.168.0.105","5.2.208.17","UDP","62","31536  >  21470 Len=20"
"119","6.995333","104.16.60.37","192.168.0.105","TLSv1.2","187","Application Data"
"120","7.012448","104.16.60.37","192.168.0.105","TLSv1.2","111","Application Data"
"121","7.012490","192.168.0.105","104.16.60.37","TCP","54","50262  >  443 [ACK] Seq=1 Ack=447 Win=254 Len=0"
"122","7.522532","192.168.0.105","86.168.130.67","TCP","66","53488  >  53681 [SYN] Seq=0 Win=64240 Len=0 MSS=1460 WS=256 SACK_PERM=1"
"123","7.526270","192.168.0.105","109.252.15.139","TCP","66","[TCP Retransmission] 53482  >  28993 [SYN] Seq=0 Win=64240 Len=0 MSS=1460 WS=256 SACK_PERM=1"
"124","7.931865","192.168.0.105","109.252.15.139","UDP","62","31536  >  28993 Len=20"
"125","8.147367","192.168.0.105","108.177.14.189","UDP","65","64942  >  443 Len=23"
"126","8.180511","108.177.14.189","192.168.0.105","UDP","65","443  >  64942 Len=23"
"127","8.488249","86.168.130.67","192.168.0.105","ICMP","94","Destination unreachable (Host unreachable)"
"128","8.517643","192.168.0.105","188.168.215.53","TCP","66","[TCP Retransmission] 53487  >  30561 [SYN] Seq=0 Win=64240 Len=0 MSS=1460 WS=256 SACK_PERM=1"
"129","8.518737","192.168.0.105","71.191.49.148","TCP","66","[TCP Retransmission] 53485  >  44829 [SYN] Seq=0 Win=64240 Len=0 MSS=1460 WS=256 SACK_PERM=1"
"130","8.533710","192.168.0.105","202.28.247.114","TCP","66","[TCP Retransmission] 53476  >  7640 [SYN] Seq=0 Win=64240 Len=0 MSS=1460 WS=256 SACK_PERM=1"
"131","8.533734","192.168.0.105","191.187.163.144","TCP","66","[TCP Retransmission] 53475  >  8073 [SYN] Seq=0 Win=64240 Len=0 MSS=1460 WS=256 SACK_PERM=1"
"132","8.537762","192.168.0.105","84.50.131.19","TCP","66","[TCP Retransmission] 53474  >  23294 [SYN] Seq=0 Win=64240 Len=0 MSS=1460 WS=256 SACK_PERM=1"
"133","8.949138","192.168.0.105","71.191.49.148","UDP","62","31536  >  44829 Len=20"
"134","8.949163","192.168.0.105","84.50.131.19","UDP","62","31536  >  23294 Len=20"
"135","8.949174","192.168.0.105","188.168.215.53","UDP","62","31536  >  30561 Len=20"
"136","8.949214","192.168.0.105","191.187.163.144","UDP","62","31536  >  8073 Len=20"
"137","8.949225","192.168.0.105","2.60.74.220","UDP","62","31536  >  26337 Len=20"
"138","8.999523","2.60.74.220","192.168.0.105","ICMP","90","Destination unreachable (Port unreachable)"
"139","9.314125","108.177.14.189","192.168.0.105","UDP","82","443  >  64942 Len=40"
"140","9.319716","192.168.0.105","108.177.14.189","UDP","81","64942  >  443 Len=39"
"141","9.532977","192.168.0.105","180.173.193.21","TCP","66","53491  >  48719 [SYN] Seq=0 Win=64240 Len=0 MSS=1460 WS=256 SACK_PERM=1"
"142","9.801260","180.173.193.21","192.168.0.105","TCP","66","48719  >  53491 [SYN, ACK] Seq=0 Ack=1 Win=8192 Len=0 MSS=1412 WS=256 SACK_PERM=1"
"143","9.801346","192.168.0.105","180.173.193.21","TCP","54","53491  >  48719 [ACK] Seq=1 Ack=1 Win=66304 Len=0"
"144","9.801479","192.168.0.105","180.173.193.21","BitTorrent","122","Handshake  "
"145","9.954679","192.168.0.105","123.201.77.69","UDP","62","31536  >  25610 Len=20"
"146","9.954713","192.168.0.105","86.168.130.67","UDP","62","31536  >  53681 Len=20"
"147","10.070993","180.173.193.21","192.168.0.105","TCP","60","48719  >  53491 [FIN, ACK] Seq=1 Ack=69 Win=66304 Len=0"
"148","10.071035","192.168.0.105","180.173.193.21","TCP","54","53491  >  48719 [ACK] Seq=69 Ack=2 Win=66304 Len=0"
"149","10.071135","192.168.0.105","180.173.193.21","TCP","54","53491  >  48719 [FIN, ACK] Seq=69 Ack=2 Win=66304 Len=0"
"150","10.221573","123.201.77.69","192.168.0.105","ICMP","90","Destination unreachable (Host unreachable)"
"151","10.340137","180.173.193.21","192.168.0.105","TCP","60","48719  >  53491 [ACK] Seq=2 Ack=70 Win=66304 Len=0"
"152","10.436807","24.105.29.76","192.168.0.105","TCP","60","443  >  53392 [FIN, ACK] Seq=1 Ack=1 Win=22080 Len=0"
"153","10.436845","192.168.0.105","24.105.29.76","TCP","54","53392  >  443 [ACK] Seq=1 Ack=2 Win=64767 Len=0"
"154","10.503040","192.168.0.105","46.188.52.206","UDP","145","31536  >  63271 Len=103"
"155","10.522868","192.168.0.105","86.168.130.67","TCP","66","[TCP Retransmission] 53488  >  53681 [SYN] Seq=0 Win=64240 Len=0 MSS=1460 WS=256 SACK_PERM=1"
"156","10.527803","192.168.0.105","190.140.143.109","UDP","62","31536  >  53912 Len=20"
"157","10.527895","192.168.0.105","190.140.143.109","TCP","66","53492  >  53912 [SYN] Seq=0 Win=64240 Len=0 MSS=1460 WS=256 SACK_PERM=1"
"158","10.527919","192.168.0.105","193.106.63.90","UDP","62","31536  >  30197 Len=20"
"159","10.527965","192.168.0.105","193.106.63.90","TCP","66","53493  >  30197 [SYN] Seq=0 Win=64240 Len=0 MSS=1460 WS=256 SACK_PERM=1"
"160","10.527984","192.168.0.105","179.191.210.134","UDP","62","31536  >  1026 Len=20"
"161","10.533965","46.188.52.206","192.168.0.105","UDP","331","63271  >  31536 Len=289"
"162","10.820517","179.191.210.134","192.168.0.105","ICMP","90","Destination unreachable (Port unreachable)"
"163","11.254505","190.140.143.109","192.168.0.105","UDP","62","53912  >  31536 Len=20"
"164","11.254605","192.168.0.105","190.140.143.109","UDP","130","31536  >  53912 Len=88"
"165","11.265580","190.140.143.109","192.168.0.105","TCP","66","53912  >  53492 [SYN, ACK] Seq=0 Ack=1 Win=65535 Len=0 MSS=1412 WS=256 SACK_PERM=1"
"166","11.265625","192.168.0.105","190.140.143.109","TCP","54","53492  >  53912 [ACK] Seq=1 Ack=1 Win=66304 Len=0"
"167","11.265745","192.168.0.105","190.140.143.109","BitTorrent","122","Handshake  "
"168","11.520840","192.168.0.105","67.170.4.184","UDP","62","31536  >  64363 Len=20"
"169","11.520957","192.168.0.105","67.170.4.184","TCP","66","53495  >  64363 [SYN] Seq=0 Win=64240 Len=0 MSS=1460 WS=256 SACK_PERM=1"
"170","11.526528","86.168.130.67","192.168.0.105","ICMP","90","Destination unreachable (Host unreachable)"
"171","11.527510","86.168.130.67","192.168.0.105","ICMP","94","Destination unreachable (Host unreachable)"
"172","11.529477","192.168.0.105","84.123.0.87","TCP","66","[TCP Retransmission] 53481  >  51464 [SYN] Seq=0 Win=64240 Len=0 MSS=1460 WS=256 SACK_PERM=1"
"173","11.748195","Tp-LinkT_19:c1:34","Giga-Byt_43:62:3a","ARP","60","Who has 192.168.0.105? Tell 192.168.0.1"
"174","11.748209","Giga-Byt_43:62:3a","Tp-LinkT_19:c1:34","ARP","42","192.168.0.105 is at e0:d5:5e:43:62:3a"
"175","11.865540","190.140.143.109","192.168.0.105","UDP","62","53912  >  31536 Len=20"
"176","11.874544","190.140.143.109","192.168.0.105","UDP","62","53912  >  31536 Len=20"
"177","11.874681","192.168.0.105","190.140.143.109","UDP","62","31536  >  53912 Len=20"
"178","11.874714","192.168.0.105","190.140.143.109","UDP","62","31536  >  53912 Len=20"
"179","11.906509","190.140.143.109","192.168.0.105","TCP","60","53912  >  53492 [FIN, ACK] Seq=1 Ack=69 Win=66048 Len=0"
"180","11.906582","192.168.0.105","190.140.143.109","TCP","54","53492  >  53912 [ACK] Seq=69 Ack=2 Win=66304 Len=0"
"181","11.906737","192.168.0.105","190.140.143.109","TCP","54","53492  >  53912 [FIN, ACK] Seq=69 Ack=2 Win=66304 Len=0"
"182","11.983570","192.168.0.105","84.123.0.87","UDP","62","31536  >  51464 Len=20"
"183","12.516510","192.168.0.105","212.142.124.114","UDP","62","31536  >  13238 Len=20"
"184","12.516617","192.168.0.105","212.142.124.114","TCP","66","53496  >  13238 [SYN] Seq=0 Win=64240 Len=0 MSS=1460 WS=256 SACK_PERM=1"
"185","12.516643","192.168.0.105","179.191.88.202","UDP","62","31536  >  10320 Len=20"
"186","12.516693","192.168.0.105","179.191.88.202","TCP","66","53497  >  10320 [SYN] Seq=0 Win=64240 Len=0 MSS=1460 WS=256 SACK_PERM=1"
"187","12.516713","192.168.0.105","89.64.24.164","UDP","62","31536  >  46437 Len=20"
"188","12.516760","192.168.0.105","89.64.24.164","TCP","66","53498  >  46437 [SYN] Seq=0 Win=64240 Len=0 MSS=1460 WS=256 SACK_PERM=1"
"189","12.546179","190.140.143.109","192.168.0.105","TCP","60","53912  >  53492 [ACK] Seq=2 Ack=70 Win=66048 Len=0"
"190","12.744771","192.168.0.105","223.223.153.247","TCP","54","53195  >  49160 [RST, ACK] Seq=1 Ack=1 Win=0 Len=0"
"191","13.518212","192.168.0.105","185.228.112.134","TCP","66","53501  >  48738 [SYN] Seq=0 Win=64240 Len=0 MSS=1460 WS=256 SACK_PERM=1"
"192","13.518259","192.168.0.105","185.228.112.134","UDP","62","31536  >  48738 Len=20"
"193","13.526808","192.168.0.105","109.252.15.139","TCP","66","[TCP Retransmission] 53482  >  28993 [SYN] Seq=0 Win=64240 Len=0 MSS=1460 WS=256 SACK_PERM=1"
"194","13.528891","192.168.0.105","193.106.63.90","TCP","66","[TCP Retransmission] 53493  >  30197 [SYN] Seq=0 Win=64240 Len=0 MSS=1460 WS=256 SACK_PERM=1"
"195","14.028563","192.168.0.105","193.106.63.90","UDP","62","31536  >  30197 Len=20"
"196","14.028598","192.168.0.105","109.252.15.139","UDP","62","31536  >  28993 Len=20"
"197","14.028609","192.168.0.105","179.191.210.134","UDP","62","31536  >  1026 Len=20"
"198","14.183721","192.168.0.105","192.168.0.1","DNS","73","Standard query 0xb1ec A wpad.cloudera"
"199","14.249527","192.168.0.1","192.168.0.105","DNS","148","Standard query response 0xb1ec No such name A wpad.cloudera SOA a.root-servers.net"
"200","14.257631","192.168.0.105","192.168.0.1","DNS","76","Standard query 0xf096 A weather.noaa.gov"
"201","14.320381","179.191.210.134","192.168.0.105","ICMP","90","Destination unreachable (Port unreachable)"
"202","14.461331","192.168.0.1","192.168.0.105","DNS","133","Standard query response 0xf096 No such name A weather.noaa.gov SOA dns02.woc.noaa.gov"
"203","14.461822","192.168.0.105","192.168.0.1","DNS","85","Standard query 0xeb43 A weather.noaa.gov.cloudera"
"204","14.518796","192.168.0.105","188.168.215.53","TCP","66","[TCP Retransmission] 53487  >  30561 [SYN] Seq=0 Win=64240 Len=0 MSS=1460 WS=256 SACK_PERM=1"
"205","14.519770","192.168.0.105","71.191.49.148","TCP","66","[TCP Retransmission] 53485  >  44829 [SYN] Seq=0 Win=64240 Len=0 MSS=1460 WS=256 SACK_PERM=1"
"206","14.520705","192.168.0.105","67.170.4.184","TCP","66","[TCP Retransmission] 53495  >  64363 [SYN] Seq=0 Win=64240 Len=0 MSS=1460 WS=256 SACK_PERM=1"
"207","14.533493","192.168.0.1","192.168.0.105","DNS","160","Standard query response 0xeb43 No such name A weather.noaa.gov.cloudera SOA a.root-servers.net"
"208","14.538337","192.168.0.105","67.170.4.184","UDP","62","31536  >  64363 Len=20"
"209","15.048113","192.168.0.105","71.191.49.148","UDP","62","31536  >  44829 Len=20"
"210","15.048134","192.168.0.105","188.168.215.53","UDP","62","31536  >  30561 Len=20"
"211","15.048143","192.168.0.105","2.60.74.220","UDP","62","31536  >  26337 Len=20"
"212","15.097527","2.60.74.220","192.168.0.105","ICMP","90","Destination unreachable (Port unreachable)"
"213","15.246274","192.168.0.105","13.107.6.171","TCP","55","52986  >  443 [ACK] Seq=1 Ack=1 Win=254 Len=1 [TCP segment of a reassembled PDU]"
"214","15.271639","13.107.6.171","192.168.0.105","TCP","66","443  >  52986 [ACK] Seq=1 Ack=2 Win=1022 Len=0 SLE=1 SRE=2"
"215","15.373603","104.16.60.37","192.168.0.105","TLSv1.2","180","Application Data"
"216","15.414061","192.168.0.105","104.16.60.37","TCP","54","50262  >  443 [ACK] Seq=1 Ack=573 Win=254 Len=0"
"217","15.517396","192.168.0.105","179.191.88.202","TCP","66","[TCP Retransmission] 53497  >  10320 [SYN] Seq=0 Win=64240 Len=0 MSS=1460 WS=256 SACK_PERM=1"
"218","15.517396","192.168.0.105","89.64.24.164","TCP","66","[TCP Retransmission] 53498  >  46437 [SYN] Seq=0 Win=64240 Len=0 MSS=1460 WS=256 SACK_PERM=1"
"219","15.518336","192.168.0.105","212.142.124.114","TCP","66","[TCP Retransmission] 53496  >  13238 [SYN] Seq=0 Win=64240 Len=0 MSS=1460 WS=256 SACK_PERM=1"
"220","15.532187","192.168.0.105","88.175.164.228","TCP","66","53506  >  32428 [SYN] Seq=0 Win=64240 Len=0 MSS=1460 WS=256 SACK_PERM=1"
"221","15.557415","192.168.0.105","89.64.24.164","UDP","62","31536  >  46437 Len=20"
"222","15.557437","192.168.0.105","179.191.88.202","UDP","62","31536  >  10320 Len=20"
"223","15.557449","192.168.0.105","212.142.124.114","UDP","62","31536  >  13238 Len=20"
"224","15.618156","88.175.164.228","192.168.0.105","TCP","66","32428  >  53506 [SYN, ACK] Seq=0 Ack=1 Win=29200 Len=0 MSS=1412 SACK_PERM=1 WS=64"
"225","15.618217","192.168.0.105","88.175.164.228","TCP","54","53506  >  32428 [ACK] Seq=1 Ack=1 Win=66304 Len=0"
"226","15.618337","192.168.0.105","88.175.164.228","BitTorrent","122","Handshake  "
"227","15.705195","88.175.164.228","192.168.0.105","TCP","60","32428  >  53506 [ACK] Seq=1 Ack=69 Win=29248 Len=0"
"228","15.722115","178.165.2.117","192.168.0.105","UDP","62","40294  >  31536 Len=20"
"229","16.054944","192.168.0.105","123.201.77.69","UDP","62","31536  >  25610 Len=20"
"230","16.497344","104.16.60.37","192.168.0.105","TLSv1.2","113","Application Data"
"231","16.518172","192.168.0.105","185.228.112.134","TCP","66","[TCP Retransmission] 53501  >  48738 [SYN] Seq=0 Win=64240 Len=0 MSS=1460 WS=256 SACK_PERM=1"
"232","16.523385","192.168.0.105","86.168.130.67","TCP","66","[TCP Retransmission] 53488  >  53681 [SYN] Seq=0 Win=64240 Len=0 MSS=1460 WS=256 SACK_PERM=1"
"233","16.538090","192.168.0.105","104.16.60.37","TCP","54","50262  >  443 [ACK] Seq=1 Ack=632 Win=253 Len=0"
"234","16.552011","123.201.77.69","192.168.0.105","ICMP","90","Destination unreachable (Host unreachable)"
"235","16.565947","192.168.0.105","185.228.112.134","UDP","62","31536  >  48738 Len=20"
"236","16.798499","87.240.129.73","192.168.0.105","TLSv1.2","334","Application Data"
"237","16.798499","87.240.129.73","192.168.0.105","TLSv1.2","334","Application Data"
"238","16.798529","192.168.0.105","87.240.129.73","TCP","54","61380  >  443 [ACK] Seq=1 Ack=561 Win=256 Len=0"
"239","16.802688","192.168.0.105","87.240.129.73","TLSv1.2","189","Application Data"
"240","16.802838","192.168.0.105","87.240.129.73","TLSv1.2","189","Application Data"
"241","16.806462","87.240.129.73","192.168.0.105","TCP","60","443  >  61380 [ACK] Seq=561 Ack=136 Win=356 Len=0"
"242","16.806462","87.240.129.73","192.168.0.105","TCP","60","443  >  61380 [ACK] Seq=561 Ack=271 Win=356 Len=0"
"243","16.806800","87.240.129.73","192.168.0.105","TLSv1.2","316","Application Data"
"244","16.847024","192.168.0.105","87.240.129.73","TCP","54","61380  >  443 [ACK] Seq=271 Ack=823 Win=255 Len=0"
"245","16.869801","192.168.0.105","87.240.182.224","TLSv1.2","1083","Application Data"
"246","16.869833","192.168.0.105","87.240.182.224","TLSv1.2","100","Application Data"
"247","16.869847","192.168.0.105","87.240.182.224","TLSv1.2","172","Application Data"
"248","16.873501","87.240.182.224","192.168.0.105","TCP","60","443  >  63659 [ACK] Seq=1 Ack=1194 Win=356 Len=0"
"249","16.873501","87.240.182.224","192.168.0.105","TLSv1.2","113","Application Data"
"250","16.905554","87.240.182.224","192.168.0.105","TLSv1.2","508","Application Data"
"251","16.905600","192.168.0.105","87.240.182.224","TCP","54","63659  >  443 [ACK] Seq=1194 Ack=514 Win=917 Len=0"
"252","17.508875","192.168.0.105","78.30.236.35","UDP","145","31536  >  30642 Len=103"
"253","17.529395","192.168.0.105","77.79.147.147","UDP","62","31536  >  1024 Len=20"
"254","17.529532","192.168.0.105","77.79.147.147","TCP","66","53509  >  1024 [SYN] Seq=0 Win=64240 Len=0 MSS=1460 WS=256 SACK_PERM=1"
"255","17.529587","192.168.0.105","192.131.44.52","UDP","62","31536  >  51957 Len=20"
"256","17.529688","192.168.0.105","192.131.44.52","TCP","66","53510  >  51957 [SYN] Seq=0 Win=64240 Len=0 MSS=1460 WS=256 SACK_PERM=1"
"257","17.529733","192.168.0.105","197.157.195.243","UDP","62","31536  >  64327 Len=20"
"258","17.529754","192.168.0.105","80.254.54.21","UDP","62","31536  >  15199 Len=20"
"259","17.583110","78.30.236.35","192.168.0.105","UDP","331","30642  >  31536 Len=289"
"260","17.667400","192.131.44.52","192.168.0.105","TCP","66","51957  >  53510 [SYN, ACK] Seq=0 Ack=1 Win=42340 Len=0 MSS=1412 SACK_PERM=1 WS=128"
"261","17.667488","192.168.0.105","192.131.44.52","TCP","54","53510  >  51957 [ACK] Seq=1 Ack=1 Win=66304 Len=0"
"262","17.667649","192.168.0.105","192.131.44.52","BitTorrent","122","Handshake  "
"263","17.669532","192.131.44.52","192.168.0.105","UDP","72","51957  >  31536 Len=30"
"264","17.669684","192.168.0.105","192.131.44.52","UDP","130","31536  >  51957 Len=88"
"265","17.774505","197.157.195.243","192.168.0.105","ICMP","90","Destination unreachable (Port unreachable)"
"266","17.803504","192.131.44.52","192.168.0.105","TCP","60","51957  >  53510 [FIN, ACK] Seq=1 Ack=1 Win=42368 Len=0"
"267","17.803572","192.168.0.105","192.131.44.52","TCP","54","53510  >  51957 [ACK] Seq=69 Ack=2 Win=66304 Len=0"
"268","17.803701","192.168.0.105","192.131.44.52","TCP","54","53510  >  51957 [FIN, ACK] Seq=69 Ack=2 Win=66304 Len=0"
"269","17.807499","192.131.44.52","192.168.0.105","UDP","62","51957  >  31536 Len=20"
"270","17.807625","192.168.0.105","192.131.44.52","UDP","62","31536  >  51957 Len=20"
"271","17.807655","192.168.0.105","192.131.44.52","UDP","62","31536  >  51957 Len=20"
"272","17.912244","192.131.44.52","192.168.0.105","UDP","62","51957  >  31536 Len=20"
"273","18.070058","192.168.0.105","192.131.44.52","TCP","122","[TCP Retransmission] 53510  >  51957 [FIN, PSH, ACK] Seq=1 Ack=2 Win=66304 Len=68"
"274","18.087382","86.168.130.67","192.168.0.105","ICMP","94","Destination unreachable (Host unreachable)"
"275","18.515291","192.168.0.105","192.131.44.52","TCP","122","[TCP Retransmission] 53510  >  51957 [FIN, PSH, ACK] Seq=1 Ack=2 Win=66304 Len=68"
"276","18.599716","192.168.0.105","178.165.2.117","UDP","62","31536  >  40294 Len=20"
"277","18.890588","192.168.0.105","104.16.60.37","TLSv1.2","115","Application Data"
"278","18.908949","104.16.60.37","192.168.0.105","TCP","60","443  >  50262 [ACK] Seq=632 Ack=62 Win=34 Len=0"
"279","19.323580","192.168.0.105","192.131.44.52","TCP","122","[TCP Retransmission] 53510  >  51957 [FIN, PSH, ACK] Seq=1 Ack=2 Win=66304 Len=68"
"280","19.345505","104.16.60.37","192.168.0.105","TLSv1.2","94","Application Data"
"281","19.385361","192.168.0.105","104.16.60.37","TCP","54","50262  >  443 [ACK] Seq=62 Ack=672 Win=259 Len=0"
"282","19.517798","192.168.0.105","209.135.211.156","TCP","66","53511  >  51413 [SYN] Seq=0 Win=64240 Len=0 MSS=1460 WS=256 SACK_PERM=1"
"283","19.517855","192.168.0.105","218.186.122.122","TCP","66","53512  >  51423 [SYN] Seq=0 Win=64240 Len=0 MSS=1460 WS=256 SACK_PERM=1"
"284","19.517900","192.168.0.105","143.137.238.42","TCP","66","53513  >  12537 [SYN] Seq=0 Win=64240 Len=0 MSS=1460 WS=256 SACK_PERM=1"
"285","19.517933","192.168.0.105","31.130.96.140","UDP","62","31536  >  57286 Len=20"
"286","19.530278","192.168.0.105","193.106.63.90","TCP","66","[TCP Retransmission] 53493  >  30197 [SYN] Seq=0 Win=64240 Len=0 MSS=1460 WS=256 SACK_PERM=1"
"287","19.611020","31.130.96.140","192.168.0.105","ICMP","90","Destination unreachable (Port unreachable)"
"288","19.657519","209.135.211.156","192.168.0.105","TCP","66","51413  >  53511 [SYN, ACK] Seq=0 Ack=1 Win=65535 Len=0 MSS=1412 WS=64 SACK_PERM=1"
"289","19.657571","192.168.0.105","209.135.211.156","TCP","54","53511  >  51413 [ACK] Seq=1 Ack=1 Win=66304 Len=0"
"290","19.657719","192.168.0.105","209.135.211.156","BitTorrent","122","Handshake  "
"291","19.770357","218.186.122.122","192.168.0.105","TCP","66","51423  >  53512 [SYN, ACK] Seq=0 Ack=1 Win=29200 Len=0 MSS=1412 SACK_PERM=1 WS=128"
"292","19.770446","192.168.0.105","218.186.122.122","TCP","54","53512  >  51423 [ACK] Seq=1 Ack=1 Win=66304 Len=0"
"293","19.770600","192.168.0.105","218.186.122.122","BitTorrent","122","Handshake  "
"294","19.797474","209.135.211.156","192.168.0.105","TCP","60","[TCP Window Update] 51413  >  53511 [ACK] Seq=1 Ack=1 Win=262592 Len=0"
"295","19.798464","209.135.211.156","192.168.0.105","TCP","60","51413  >  53511 [FIN, ACK] Seq=1 Ack=69 Win=262592 Len=0"
"296","19.798506","192.168.0.105","209.135.211.156","TCP","54","53511  >  51413 [ACK] Seq=69 Ack=2 Win=66304 Len=0"
"297","19.798601","192.168.0.105","209.135.211.156","TCP","54","53511  >  51413 [FIN, ACK] Seq=69 Ack=2 Win=66304 Len=0"
"298","19.849312","143.137.238.42","192.168.0.105","TCP","60","12537  >  53513 [RST, ACK] Seq=1 Ack=1 Win=0 Len=0"
"299","19.938496","209.135.211.156","192.168.0.105","TCP","60","51413  >  53511 [ACK] Seq=2 Ack=70 Win=262592 Len=0"
"300","20.021539","218.186.122.122","192.168.0.105","TCP","60","51423  >  53512 [ACK] Seq=1 Ack=69 Win=29312 Len=0"
"301","20.110498","218.186.122.122","192.168.0.105","TCP","60","51423  >  53512 [FIN, ACK] Seq=1 Ack=69 Win=29312 Len=0"
"302","20.110546","192.168.0.105","218.186.122.122","TCP","54","53512  >  51423 [ACK] Seq=69 Ack=2 Win=66304 Len=0"
"303","20.110634","192.168.0.105","218.186.122.122","TCP","54","53512  >  51423 [FIN, ACK] Seq=69 Ack=2 Win=66304 Len=0"
"304","20.120497","104.16.60.37","192.168.0.105","TLSv1.2","190","Application Data"
"305","20.135738","192.168.0.105","193.106.63.90","UDP","62","31536  >  30197 Len=20"
"306","20.135760","192.168.0.105","179.191.210.134","UDP","62","31536  >  1026 Len=20"
"307","20.160258","192.168.0.105","104.16.60.37","TCP","54","50262  >  443 [ACK] Seq=62 Ack=808 Win=258 Len=0"
"308","20.240359","fe80::10ee:5aa1:6e82:e9bc","ff02::2","ICMPv6","70","Router Solicitation from d4:61:da:72:ea:f3"
"309","20.349026","192.168.0.105","143.137.238.42","TCP","66","[TCP Retransmission] 53513  >  12537 [SYN] Seq=0 Win=64240 Len=0 MSS=1460 WS=256 SACK_PERM=1"
"310","20.361176","218.186.122.122","192.168.0.105","TCP","60","51423  >  53512 [ACK] Seq=2 Ack=70 Win=29312 Len=0"
"311","20.424824","179.191.210.134","192.168.0.105","ICMP","90","Destination unreachable (Port unreachable)"
"312","20.522627","192.168.0.105","67.170.4.184","TCP","66","[TCP Retransmission] 53495  >  64363 [SYN] Seq=0 Win=64240 Len=0 MSS=1460 WS=256 SACK_PERM=1"
"313","20.529465","192.168.0.105","77.79.147.147","TCP","66","[TCP Retransmission] 53509  >  1024 [SYN] Seq=0 Win=64240 Len=0 MSS=1460 WS=256 SACK_PERM=1"
"314","20.601609","192.168.0.106","224.0.0.251","MDNS","159","Standard query 0x0000 PTR _homekit._tcp.local, ""QU"" question PTR _raop._tcp.local, ""QU"" question PTR _airplay._tcp.local, ""QU"" question PTR _sleep-proxy._udp.local, ""QU"" question OPT"
"315","20.602559","fe80::10ee:5aa1:6e82:e9bc","ff02::fb","MDNS","179","Standard query 0x0000 PTR _homekit._tcp.local, ""QU"" question PTR _raop._tcp.local, ""QU"" question PTR _airplay._tcp.local, ""QU"" question PTR _sleep-proxy._udp.local, ""QU"" question OPT"
"316","20.602559","fe80::10ee:5aa1:6e82:e9bc","ff02::fb","MDNS","278","Standard query response 0x0000 PTR, cache flush iPad-Andrey.local PTR, cache flush iPad-Andrey.local NSEC, cache flush C.B.9.E.2.8.E.6.1.A.A.5.E.E.0.1.0.0.0.0.0.0.0.0.0.0.0.0.0.8.E.F.ip6.arpa NSEC, cache flush 106.0.168.192.in-addr.arpa OPT"
"317","20.602560","192.168.0.106","224.0.0.251","MDNS","258","Standard query response 0x0000 PTR, cache flush iPad-Andrey.local PTR, cache flush iPad-Andrey.local NSEC, cache flush C.B.9.E.2.8.E.6.1.A.A.5.E.E.0.1.0.0.0.0.0.0.0.0.0.0.0.0.0.8.E.F.ip6.arpa NSEC, cache flush 106.0.168.192.in-addr.arpa OPT"
"318","20.641070","192.168.0.106","224.0.0.22","IGMPv3","60","Membership Report / Join group 224.0.0.251 for any sources"
"319","20.641365","192.168.0.105","80.254.54.21","UDP","62","31536  >  15199 Len=20"
"320","20.641381","192.168.0.105","77.79.147.147","UDP","62","31536  >  1024 Len=20"
"321","20.641392","192.168.0.105","197.157.195.243","UDP","62","31536  >  64327 Len=20"
"322","20.641400","192.168.0.105","67.170.4.184","UDP","62","31536  >  64363 Len=20"
"323","20.662228","143.137.238.42","192.168.0.105","TCP","60","12537  >  53513 [RST, ACK] Seq=1 Ack=1 Win=0 Len=0"
"324","20.751218","108.177.14.189","192.168.0.105","UDP","81","443  >  64942 Len=39"
"325","20.752651","108.177.14.189","192.168.0.105","UDP","60","443  >  64942 Len=18"
"326","20.757342","192.168.0.105","108.177.14.189","UDP","81","64942  >  443 Len=39"
"327","20.886226","197.157.195.243","192.168.0.105","ICMP","90","Destination unreachable (Port unreachable)"
"328","20.939612","192.168.0.105","192.131.44.52","TCP","122","[TCP Retransmission] 53510  >  51957 [FIN, PSH, ACK] Seq=1 Ack=2 Win=66304 Len=68"
"329","20.957516","192.168.0.106","224.0.0.251","MDNS","211","Standard query 0x0000 ANY iPad (Andrey)._companion-link._tcp.local, ""QU"" question ANY iPad-Andrey.local, ""QU"" question SRV 0 0 49152 iPad-Andrey.local AAAA fe80::10ee:5aa1:6e82:e9bc A 192.168.0.106 OPT"
"330","20.958050","fe80::10ee:5aa1:6e82:e9bc","ff02::fb","MDNS","231","Standard query 0x0000 ANY iPad (Andrey)._companion-link._tcp.local, ""QU"" question ANY iPad-Andrey.local, ""QU"" question SRV 0 0 49152 iPad-Andrey.local AAAA fe80::10ee:5aa1:6e82:e9bc A 192.168.0.106 OPT"
"331","21.020641","192.168.0.105","64.233.162.189","UDP","65","51086  >  443 Len=23"
"332","21.031355","64.233.162.189","192.168.0.105","UDP","67","443  >  51086 Len=25"
"333","21.161389","192.168.0.105","108.177.14.189","UDP","304","64942  >  443 Len=262"
"334","21.162312","192.168.0.105","87.240.129.73","TLSv1.2","190","Application Data"
"335","21.162371","192.168.0.105","143.137.238.42","TCP","66","[TCP Retransmission] 53513  >  12537 [SYN] Seq=0 Win=64240 Len=0 MSS=1460 WS=256 SACK_PERM=1"
"336","21.189821","108.177.14.189","192.168.0.105","UDP","235","443  >  64942 Len=193"
"337","21.189822","108.177.14.189","192.168.0.105","UDP","79","443  >  64942 Len=37"
"338","21.196635","192.168.0.105","108.177.14.189","UDP","81","64942  >  443 Len=39"
"339","21.207545","87.240.129.73","192.168.0.105","TCP","60","443  >  61380 [ACK] Seq=823 Ack=407 Win=356 Len=0"
"340","21.222577","192.168.0.106","224.0.0.251","MDNS","211","Standard query 0x0000 ANY iPad (Andrey)._companion-link._tcp.local, ""QM"" question ANY iPad-Andrey.local, ""QM"" question SRV 0 0 49152 iPad-Andrey.local AAAA fe80::10ee:5aa1:6e82:e9bc A 192.168.0.106 OPT"
"341","21.223027","fe80::10ee:5aa1:6e82:e9bc","ff02::fb","MDNS","231","Standard query 0x0000 ANY iPad (Andrey)._companion-link._tcp.local, ""QM"" question ANY iPad-Andrey.local, ""QM"" question SRV 0 0 49152 iPad-Andrey.local AAAA fe80::10ee:5aa1:6e82:e9bc A 192.168.0.106 OPT"
"342","21.468080","192.168.0.106","224.0.0.251","MDNS","211","Standard query 0x0000 ANY iPad (Andrey)._companion-link._tcp.local, ""QM"" question ANY iPad-Andrey.local, ""QM"" question SRV 0 0 49152 iPad-Andrey.local AAAA fe80::10ee:5aa1:6e82:e9bc A 192.168.0.106 OPT"
"343","21.468535","fe80::10ee:5aa1:6e82:e9bc","ff02::fb","MDNS","231","Standard query 0x0000 ANY iPad (Andrey)._companion-link._tcp.local, ""QM"" question ANY iPad-Andrey.local, ""QM"" question SRV 0 0 49152 iPad-Andrey.local AAAA fe80::10ee:5aa1:6e82:e9bc A 192.168.0.106 OPT"
"344","21.509157","143.137.238.42","192.168.0.105","TCP","60","12537  >  53513 [RST, ACK] Seq=1 Ack=1 Win=0 Len=0"
"345","21.517403","192.168.0.105","179.191.88.202","TCP","66","[TCP Retransmission] 53497  >  10320 [SYN] Seq=0 Win=64240 Len=0 MSS=1460 WS=256 SACK_PERM=1"
"346","21.517404","192.168.0.105","89.64.24.164","TCP","66","[TCP Retransmission] 53498  >  46437 [SYN] Seq=0 Win=64240 Len=0 MSS=1460 WS=256 SACK_PERM=1"
"347","21.519363","192.168.0.105","212.142.124.114","TCP","66","[TCP Retransmission] 53496  >  13238 [SYN] Seq=0 Win=64240 Len=0 MSS=1460 WS=256 SACK_PERM=1"
"348","21.606168","192.168.0.106","224.0.0.251","MDNS","159","Standard query 0x0000 PTR _homekit._tcp.local, ""QM"" question PTR _raop._tcp.local, ""QM"" question PTR _airplay._tcp.local, ""QM"" question PTR _sleep-proxy._udp.local, ""QM"" question OPT"
"349","21.606529","fe80::10ee:5aa1:6e82:e9bc","ff02::fb","MDNS","179","Standard query 0x0000 PTR _homekit._tcp.local, ""QM"" question PTR _raop._tcp.local, ""QM"" question PTR _airplay._tcp.local, ""QM"" question PTR _sleep-proxy._udp.local, ""QM"" question OPT"
